,,,,,,,,,,,,,,,,001,XXXXX,2021-12-11_16h23.11.197,musical_judgments,2021.2.3,Win32,60.11421701,,,,,,,,,,,,,,,,,,0,2,2,2,1,2,"Die Fab Four sind eine der bekanntesten Beatles Tribute Bands der Welt. Sie sind bereits unter anderem in Japan, Malaysia, Frankreich, Deutschland, den USA und Australien aufgetreten.
Die Band zeichnet sich durch ihre Liebe zum Detail aus. Sie verkörpern die Beatles in ihrem Verhalten, ihrer Sprechweise, ihrem Äußerem und vor allem in ihrem musikalischen Stil. Um authentisch zu wirken verzichtet die Band in jeglicher Form auf Lipsync und Ardy Sarraf, der eigentlich Rechtshänder ist, hat sich sogar antrainiert den Bass, wie Paul McCartney, mit links zu spielen.  
Die Leidenschaft der Gruppe hat sich ausgezahlt, so waren sie schon bei großen TV-Shows wie der Ellen Show oder Good Morning America zu Gast. Seit ihrer Gründung 1997 waren sie bereits viermal Headliner für die International Beatlesweek Liverpool und 2013 gewannen sie sogar einen Emmy Award für ihr PBS Special „The Fab Four: The Ultimate Tribute“.

Quelle: https://www.thefabfour.com/",beatles.wav,high,rock,2,LXZNFMHY,,,,,,,,,,,,,,,,,,
,,,,,,,,,,,,,,,,001,XXXXX,2021-12-11_16h23.11.197,musical_judgments,2021.2.3,Win32,60.11421701,,,,,,,,,,,Wie sehr gefiel Ihnen das erste Lied im Vergleich zu den anderen?,,,,,,,,,,,,,,,,,,,84.48494615,2.5662,space,2.5233,0,0,0,0,1,,,,,,,,,
,,,,,,,,,,,,,,,,001,XXXXX,2021-12-11_16h23.11.197,musical_judgments,2021.2.3,Win32,60.11421701,,,,,,,,,,,Wie sehr gefiel Ihnen das zweite Lied im Vergleich zu den anderen?,,,,,,,,,,,,,,,,,,,19.75612174,1.6011,space,0.4994,0,1,1,1,1,,,,,,,,,
,,,,,,,,,,,,,,,,001,XXXXX,2021-12-11_16h23.11.197,musical_judgments,2021.2.3,Win32,60.11421701,,,,,,,,,,,Wie sehr gefiel Ihnen das dritte Lied im Vergleich zu den anderen?,,,,,,,,,,,,,,,,,,,45.86989796,0.8624,space,0.686,0,2,2,2,1,,,,,,,,,
,,,,,,,,,,,,,,,,001,XXXXX,2021-12-11_16h23.11.197,musical_judgments,2021.2.3,Win32,60.11421701,,,,,,,,,,,,,,,,,,,,,,,,,,,,,,,,,,,,,,,5,6.964,space,0.3837,1,0,1,0,1
